{
  "slug": "gato-de-schrodinger",
  "status": "open",
  "order": 2,
  "title": "O gato de Schrödinger",
  "subtitle": "O experimento mental mais famoso da física foi, na verdade, uma crítica. Abra a caixa.",
  "track": "fundamentos",
  "audience": "curioso",
  "icon": "🐈",
  "duration": "~7 min",
  "tags": ["superposição", "decoerência", "história"],
  "author": "2T0nnks",
  "license": "CC-BY-SA-4.0",
  "steps": [
    {
      "type": "story",
      "icon": "📦",
      "title": "Uma caixa, um gato, um átomo",
      "body": [
        "Em 1935, Erwin Schrödinger propôs um cenário: um gato numa caixa fechada com um átomo radioativo. Se o átomo decair, um mecanismo libera veneno. Em uma hora, há 50% de chance de isso acontecer.",
        "Segundo a mecânica quântica, enquanto ninguém mede, o átomo fica em superposição de “decaiu” e “não decaiu”. E o gato, preso ao destino do átomo, ficaria… vivo e morto?",
        "Schrödinger não achava que gatos ficam vivos e mortos. Ele queria mostrar como parece absurdo levar a superposição ao pé da letra para coisas do nosso tamanho."
      ],
      "aside": "Nenhum gato foi ferido na história da física. O experimento é só mental."
    },
    {
      "type": "quiz",
      "question": "Por que Schrödinger inventou o gato?",
      "options": [
        { "text": "Para provar que gatos podem estar vivos e mortos ao mesmo tempo.", "why": "Era o contrário: ele usou o gato justamente porque ninguém acredita nisso. O absurdo era o argumento." },
        { "text": "Para criticar a ideia de que a superposição vale igualzinho para objetos do dia a dia.", "correct": true, "why": "Isso. O texto de 1935 discutia o problema da medição: onde termina o mundo quântico e começa o clássico? A pergunta ainda gera debate." },
        { "text": "Para um experimento real de laboratório.", "why": "Nunca foi feito com gatos. Mas versões com objetos cada vez maiores — moléculas, cristais minúsculos — são feitas de verdade hoje." }
      ]
    },
    {
      "type": "measure",
      "title": "Abra a caixa (muitas vezes)",
      "body": "Aqui o átomo é um qubit colocado em superposição (H), e o gato é outro qubit que “copia” o átomo com uma porta CNOT: se o átomo decair (1), o gato muda para 1 também. Abra a caixa várias vezes.",
      "qubits": 2,
      "wires": ["átomo", "gato"],
      "circuit": ["H 0", "CNOT 0 1"],
      "minShots": 20,
      "after": "Você só vê <code>00</code> (não decaiu, gato vivo) ou <code>11</code> (decaiu, gato… bem). Nunca <code>01</code> ou <code>10</code>. Átomo e gato ficaram <strong>emaranhados</strong>: não dá mais para descrever um sem o outro."
    },
    {
      "type": "predict",
      "question": "Antes de abrir, qual a chance de encontrar o gato vivo (gato = 0), não importa o átomo?",
      "qubits": 2,
      "wires": ["átomo", "gato"],
      "circuit": ["H 0", "CNOT 0 1"],
      "outcome": "x0",
      "explain": "50%. O gato sozinho parece uma moeda comum — o estranho está na <em>correlação</em> perfeita com o átomo, não nas chances de cada um."
    },
    {
      "type": "story",
      "icon": "🌫️",
      "title": "Então por que nunca vemos gatos em superposição?",
      "body": [
        "Um gato de verdade troca calor, luz e ar com o ambiente o tempo todo. Cada fóton que bate nele e escapa carrega um pouquinho de informação sobre “vivo ou morto”.",
        "Essa informação vazada emaranha o gato com trilhões de partículas do ambiente, e a superposição deixa de produzir efeitos observáveis. O nome disso é <strong>decoerência</strong>, e ela é rapidíssima para objetos grandes.",
        "É também o grande inimigo dos computadores quânticos: por isso os qubits ficam isolados, no vácuo ou resfriados a centésimos de grau acima do zero absoluto."
      ]
    },
    {
      "type": "fact",
      "icon": "🔬",
      "title": "Quão grande dá para ir?",
      "text": "Em 2019, um grupo em Viena fez moléculas com cerca de 2.000 átomos (mais de 25.000 unidades de massa atômica) passarem por um interferômetro e mostrarem interferência — comportamento de onda, como se passassem por mais de um caminho ao mesmo tempo. Não há limite de tamanho conhecido: o desafio é só isolar o objeto bem o suficiente.",
      "source": "Fein et al., Nature Physics (2019)."
    },
    {
      "type": "quiz",
      "question": "Qual o principal motivo de não vermos objetos grandes em superposição no dia a dia?",
      "options": [
        { "text": "As leis quânticas só valem para coisas pequenas.", "why": "Até onde se sabe, as leis são as mesmas para tudo. O que muda é o quanto o objeto conversa com o ambiente." },
        { "text": "Decoerência: o ambiente “espalha” a informação e a superposição deixa de interferir.", "correct": true, "why": "Isso. Quanto maior e mais quente o objeto, mais rápido ele se emaranha com o ambiente e passa a se comportar de forma clássica." },
        { "text": "A gravidade destrói a superposição.", "why": "Há propostas (como a de Roger Penrose) de que a gravidade poderia ter um papel, mas isso ainda não foi observado. A decoerência já é bem estabelecida." }
      ]
    }
  ],
  "takeaways": [
    "O gato foi uma crítica: Schrödinger achava absurdo aplicar a superposição sem cuidado a objetos grandes.",
    "Átomo e gato ficam emaranhados: os resultados são correlacionados mesmo que cada um, sozinho, pareça aleatório.",
    "Decoerência explica por que o mundo grande parece clássico — e por que qubits precisam de tanto isolamento."
  ],
  "terms": ["superposicao", "emaranhamento", "decoerencia", "colapso", "cnot"],
  "further": [
    { "title": "Stanford Encyclopedia of Philosophy — Measurement in Quantum Theory", "url": "https://plato.stanford.edu/entries/qt-measurement/" }
  ]
}
